num,pairs,text973,"('subrayó', '')","En este sentido, subrayó los largos plazos de pago que sufren los proveedores de algunas grandes superficies, pese a la existencia de la ley de comercio que prohíbe esas prácticas."
980,"('Schumacher', 'reconoció')","""Los problemas en la pierna izquierda (en la que sufrió una doble fractura de tibia y peroné) son demasiado graves y así es prácticamente imposible correr"", reconoció Schumacher."
985,"('saldó', '')",El accidente se saldó sin heridos.
993,"('enfrentará', '')",Mañana se enfrentará a Hungría en las semifinales de la Copa del Mundo.
997,"('tendrá', '')","Si España termina cuarta en la Copa del Mundo, aún tendrá una última oportunidad en el Preolímpico, que se disputará en la ciudad alemana de Hannóver en mayo del 2000."
1010,"('complicó', '')",Se nos complicó al principio cuando los australianos se pusieron 3-1.
1011,"('técnico', 'afirmó')","No nos dejaban llegar a portería y, a la vez, nos pitaron 14 faltas ofensivas, algo insólito que nunca viví en mi carrera como seleccionador "", afirmó a Efe el técnico Joan Jané."
1013,"('Jané', 'añadió')","Hoy era el día D, teníamos la posibilidad de ir a semifinales y luchar por estar en los Juegos "", añadió Jané."
1017,"('aventura', 'Termina')","Termina así la aventura de Bakero en el banquillo ya que en los 13 partidos que ha dirigido al Puebla, cinco del torneo anterior y ocho del actual, sólo ha ganado dos encuentros, ha empatado cuatro y ha encajado siete derrotas."
1022,"('tuvieron', '')","Los helicópteros de salvamento españoles y otros barcos tuvieron que rescatar ayer a otros tres navegantes solitarios que participan en la travesía del Atlántico reservada a barcos de menos de 6,5 metros."
1031,"('presidente', 'limitó')","""Escucho las reivindicaciones; me lo apunto"", se limitó a decir el presidente de la Generalitat, que inauguró en Tarragona el segundo Congreso de la Abogacía Catalana, al que también asistieron, entre otros, la consellera de Justícia, Núria de Gispert, y el presidente del Consejo de la Abogacía, Eugeni Gay."
1033,"('debatirán', '')","Durante tres días debatirán la pasantía, los honorarios, la asistencia jurídica gratuita, la normalización del catalán y otros temas del mundo del derecho."
1040,"('dijo', '')","""Es injusto"", dijo."
1042,"('Añadió', '')","Añadió que el Gobierno se comprometió a rebajar la retención al 18%, lo que, en su opinión, no basta."
1043,"('afirmó', '')","""Es un trato confiscatorio"", afirmó, y apuntó la necesidad de un pacto de Estado sobre Justicia."
1045,"('señaló', '')","""Me lo apunto"", señaló."
1048,"('Reconoció', '')","Reconoció que en el texto de esta última normativa hay ""algunos anzuelos"" en temas que benefician al Govern, aunque avisó: ""No nos pueden acusar de desleales"", en respuesta a unas declaraciones efectuadas por el portavoz del Gobierno, Josep Piqué."
1049,"('Insistió', '')",Insistió en que no se votó a favor de la propuesta del PP porque no existía consenso entre los profesionales del derecho.
1068,"('espuma', 'disipado')","Por eso, cuando aún no se había disipado la espuma de su descorche como rey, ya estaba manos a la obra y sellaba una alianza con los partidos democráticos y la élite progresista con un único fin: salvar Marruecos."
1069,"('Mohamed', 'explica')","""El rey y las fuerzas democráticas están dando a Marruecos la única y última oportunidad para salir adelante"", explica Mohamed Al Gahs, director del diario socialista Libération."
1074,"('Mohamed', 'afirma')","Tenemos ya los gérmenes que han destruido países, los han ensangrentado o los han hundido en la oscuridad de la dictadura "", afirma Mohamed Al Gahs, para justificar esta monarquía ilustrada que va a imponer a los marroquís el sistema Todo por el pueblo, pero sin el pueblo."
1075,"('Alí', 'opina')","""Estamos viviendo una primera fase de liberalización política, en la que la democracia es aún un proyecto a construir"", opina Alí Buabid, un joven político de izquierdas, para definir la situación, intereses de una sociedad que ya no cree en ellos."
1077,"('reconoce', '')","""La capacidad de absorción por las élites políticas marroquís de la cultura democrática es aún demasiado débil como para imaginar por ahora otra cosa que una monarquía fuerte"", reconoce."
1078,"('Tienen', '')","""Tienen interiorizado de tal manera los principios arcaicos de la autoridad - - dice Buabid - - que necesitan un poco de tiempo para descubrir las virtudes de la autonomía""."
1080,"('rey', 'juega')","Esta función la juega el rey que, aunque parezca un contrasentido, se ha convertido en el motor del cambio."
1081,"('diplomático', 'va')","""Por ahora, no va a haber elecciones verdaderamente libres ya que la sociedad civil carece de la fuerza necesaria para contener la marea de desesperados que, en caso de que se celebraran unos comicios, daría la victoria a los integristas"", afirma un diplomático."
1086,"('permitió', '')","Primero permitió volver sin condiciones a Abraham Serfaty, a quien su padre convirtió en el preso político más longevo de Africa después de Nelson Mandela por el pecado de defender el derecho a la autodeterminación de los saharauis."
1087,"('facilitó', '')","Después facilitó el regreso de la familia de Mehdi Ben Barka, el opositor secuestrado y asesinado."
1090,"('entramado', 'conoce')","Con este apelativo se conoce el entramado de clientelismo y corrupción que Dris Basri, el todopoderoso ministro del Interior, forjó en los 25 años que lleva en el cargo y en los que fue la implacable mano ejecutora de los designios de Hassan II."
1099,"('es', '')","Por eso, lo que ha hecho el nuevo rey es saltarse el sistema, creando organismos nuevos apadrinados por él mismo para atender las prioridades del país y evitar así que sus deseos se pierdan en los laberintos de la burocracia."
1103,"('es', '')","Sin embargo, si hay algo que el monarca debe hacer rápido es atacar la situación de pobreza y miseria en la que viven muchos marroquís."
1105,"('diplomático', 'señala')","""Si no actúa pronto, todo saltará por los aires"", señala un diplomático apuntando hacia el creciente poder de los integristas, en especial del movimiento Justicia y Caridad, que es, con creces, la formación capaz de movilizar a más gente en todo Marruecos."
1107,"('giro', 'Es')",Es este necesario giro social el que concreta la alianza entre el rey y los partidos democráticos.
1115,"('estaba', '')","A los 2 años de edad ya estaba en Badalona y de muy niño empezó a jugar al baloncesto en el colegio de los salesianos; cumplidos los 13 ingresó en el Joventut, y en la Penya sigue: primero, como jugador durante 17 años; luego, como organizador de actividades, y luego, casi seguido, como vicepresidente de la directiva a cuya presidencia acaba de acceder."
1126,"('hace', '')","Y lo hace con acierto: el resultado es una versión estilizada, conservadora en el mejor sentido del término, y permite a los cantantes concentrarse en el plano vocal sin pedirles grandes exigencias dramáticas."
1127,"('Vick', 'permite')","Sólo en la descripción visual de lord Arturo Bucklaw, interpretado por Carlos Cosías, se permite Vick alguna pequeña ironía."
1128,"('cuenta', '')","En esta versión, además, cuenta con una June Anderson en plena forma que sirvió una ejemplar escena de la locura, la más esperada por los aficionados."
1131,"('recordar', '')",Para recordar.
1145,"('años', 'pasado')",- - Han pasado más de cuatro años desde su último disco.
1147,"('salido', '')",Ha salido así.
1150,"('firma', 'aparece')","En esta canción aparece la firma de Pedro Ayres, de Madredeus."
1151,"('buscó', '')",¿Qué buscó en él? - -.
1154,"('hubo', '')","Como casi siempre, no hubo nada premeditado."
1155,"('planteé', '')","Ni siquiera me planteé hacer una canción con aire portugués, porque Sentir suena más bien italiana."
1157,"('Trabajo', '')",- - Trabajo con ella desde 1983.
1158,"('Tenemos', '')",Tenemos un largo camino hecho y eso facilita las cosas.
1160,"('atmósferas', 'abundan')",- - En Un mar de confianza abundan las atmósferas y los medios tiempos.
1161,"('Desea', '')",¿Desea alejarse del campo del rock? - -.
1162,"('Es', '')",Es que no podría hacer un corte como Sumisa de otra manera; sería seguir un tópico sólo por mantener lo que se espera de mí.
1163,"('pienso', '')",No pienso si voy a sonar más dura o más blanda; doy a las canciones lo que exigen.
1165,"('Depende', '')",Depende de cada adulto.
1166,"('interesa', '')",A mí no me interesa hacer cosas ya hechas.
1167,"('gusta', '')","Me gusta pensar que avanzo, aunque a veces no sea hacia adelante sino dando giros."
1168,"('hay', '')","A causa de esto, hay quien ha dicho que después de Piensa en mí he cambiado."
1169,"('grabado', '')",Pero si hubiera cambiado tanto como algunos malintencionados predecían habría grabado cuatro discos de boleros.
1170,"('hago', '')","Al final, en mi trabajo hago sobre todo lo que me da la gana; no atiendo a nada más."
1171,"('siente', '')",- - ¿Se siente responsable de la actualización del bolero a raíz del éxito de Piensa en mí? - -.
1174,"('Canto', '')","Canto lo que me apetece, porque tengo que ser honesta conmigo misma."
1175,"('tiempo', 'pasado')",Ha pasado el tiempo y ahora la gente ya no se rasga las vestiduras por algo así.
1176,"('recuperación', 'parece')",- - ¿Le parece aprovechable la recuperación de la música popular cubana? - -.
1177,"('pareció', '')","Cuando Santiago Auserón, que me parece la persona más preclara, empezó a rescatarla me pareció maravilloso."
1180,"('hay', '')",- - Sí lo hay: ¿le estimulan las últimas hornadas del pop? - -.
1181,"('visto', '')",No he visto ningún grupo nuevo que me parezca un bombazo.
1182,"('sigo', '')",Pero sigo escuchando música; siempre me rodeo de cuatro o cinco discos.
1183,"('recuperado', '')","Ultimamente he recuperado a Scritti Politti y escucho a Alex Gopher, Beck, Smashing Pumpkins...."
1185,"('Prefiero', '')",Prefiero no opinar sobre los artistas españoles.
1187,"('Pienso', '')","Pienso que un grupo que vende tendrá algo que yo no he sabido ver, y lo respeto."
1188,"('yo', 'seré')",No seré yo quien diga que es un horror.
1189,"('atribuye', '')",- - ¿A qué atribuye su éxito comercial en Francia? - -.
1190,"('tengo', '')",No tengo ni la más remota idea.
1193,"('canciones', 'gustado')","Habrán gustado las canciones por sí mismas, no porque yo les haya caído simpática."
1194,"('grabado', '')","Ahora he grabado Sentir en francés, con una mezcla de Alex Gopher, y sale en sencillo este mes."
1196,"('Intento', '')","Intento relacionarlas, o bien por tempos o porque hablan de cosas semejantes."
1197,"('actualizado', '')","He actualizado A cada paso, una canción muy ochentera."
1198,"('mezclando', '')","Estoy mezclando canciones nuevas y antiguas, porque no me gusta que haya sólo un tipo de reacción ante un concierto; quiero que haya emoción y también despelote."
1204,"('basta', '')","Para vencer en Nueva Hampshire no basta con desafiar al frío y a la nieve, o a los competidores."
1206,"('esposa', 'confirmó')","""Mi marido es extrañamente supersticioso"", confirmó ayer su esposa Cindy."
1207,"('Cindy', 'dijo')","Precisamente por ello, el senador por Arizona pensaba ayer matar la ansiedad yéndose al cine, ""como hace todos los días de elecciones"", dijo Cindy."
1209,"('llevado', '')","Hasta ha llevado en el bolsillo la brújula que le regaló un votante de este estado ""para que fuera siempre por el buen camino"", según le dijo."
1226,"('provocado', '')","Asimismo, han provocado un sufrimiento suplementario innecesario a las familias de los implicados con las informaciones publicadas, que, según nuestra opinión, no se corresponden con la realidad."
1231,"('Anunciaron', '')","Anunciaron que pedirán la apertura de una investigación judicial por considerar que ""ha habido una dejadez asistencial""."
1236,"('medallas', 'sirven')","De nada sirven las medallas olímpicas, los primeros puestos en campeonatos del mundo y europeos (torneo de París, etcétera)."
1243,"('tiene', '')",¿Qué más tiene que hacer el judo para que las televisiones le den el trato que se merece un deporte que es y será uno de los más aclamados?.
1257,"('Narváez', 'afirma')","""Estas actuaciones demuestran que Barcelona apuesta por el comercio de barrio"", afirma Narváez."
1259,"('habrá', '')",Entre la Meridiana y la calle del Coronel Sanfeliu habrá dos carriles reservados para la circulación - - en las circunstancias en que esté permitida - - y la carga y descarga.
1260,"('carril', 'reservará')",En el resto de la calle se reservará un solo carril.
1263,"('asegura', '')","""Lo estamos reclamando desde hace 15 años"", asegura."
1265,"('Arévalo', 'añade')","""Nosotros pedimos aceras anchas, y desde el ayuntamiento siempre nos habían hablado de semipeatonalización"", añade Arévalo, que aboga por que a determinadas horas se permita la circulación bajando los pilones."
1267,"('Narváez', 'explica')","""El pasaje se humanizará cerrándolo al tráfico y al estacionamiento de coches"", explica Narváez."
1277,"('delfín', 'Muere')",Muere el delfín rescatado herido en Alicante.
1280,"('recuperación', 'finalizó')","En el CRAM finalizó con éxito, hace un mes, la recuperación de otro delfín hallado en Mataró."
1286,"('plan', 'abordó')","En él, según manifestó Redondo Terreros a Europa Press, no se abordó el plan de paz propuesto por Ibarretxe en Junio, tal y como se había anunciado."
1291,"('Aboga', '')",Aboga por tejer una unidad sólida y de fondo de todos los demócratas.
1297,"('pidió', '')","Por ello, pidió que el portavoz del PNV, Iñaki Anasagasti, y el ministro del Interior, Jaime Mayor Oreja, aprovechen el encuentro de mañana y se ""digan las cosas claras""."
1298,"('Insistió', '')","Insistió en que el Gobierno tiene ""la lealtad y cooperación permanente"" del PSOE a la hora de definir una política de Estado frente al terrorismo."
1300,"('espetó', '')","Sin embargo, desde el compromiso y la voluntad de trabajar juntos, espetó al presidente que es la hora de que ""gobierne"" y ""optimice"" la eficacia policial."
1302,"('Anunció', '')","Anunció que trasladará al lehendakari la posición del PSOE y su ""exigencia"" de que ""se garantice la seguridad y libertad de todos los ciudadanos"", pero evitó pronunciarse sobre el nuevo foro de partidos que Ibarretxe quiere impulsar."
1303,"('es', '')","Lo que sí reconoció es que la trayectoria del PNV durante los últimos meses ""no aporta la confianza suficiente para compartir un proyecto en defensa de la paz""."
1306,"('Añadió', '')","Añadió también que el Ejecutivo de Vitoria es ""débil, incapaz de liderar una situación sin precedentes y con el pecado original de haber sido votado por EH""."
1308,"('Advirtió', '')","Advirtió a sus antiguos socios de que si siguen por la senda de los últimos meses, dejarán de ser un partido necesario y se convertirán en un ""lastre"" para sí mismos y para la sociedad."
1309,"('avisó', '')","En este sentido, avisó a Ibarretxe de que a su Gobierno el tiempo se le ""acaba""."
1313,"('Rodolfo', 'Fallece')","Fallece Rodolfo Bay Wright, fundador de la aerolínea Spantax."
1336,"('escatimado', '')",Para celebrar este 50 aniversario no se ha escatimado en gastos: 100 jóvenes de 18 a 25 años rivalizando hasta el último minuto por un título merecen una audiencia digna de una Copa del Mundo de fútbol.
1337,"('hay', '')","En el inicio de este tinglado de princesas por unos días hay que recordar a Eric Morley, fallecido el pasado noviembre."
1339,"('era', '')",En realidad lo que quería era simplemente atraer la atención sobre su cadena de teatro y salas de juego.
1340,"('encontró', '')",Pero encontró un filón y aquel hallazgo publicitario obtuvo un eco desmedido.
1343,"('bombas', 'Volaron')","Volaron bombas de harina contra un espectáculo, al parecer de muchas, vulgar y degradante."
1345,"('llevaron', '')","De entrada se llevaron a las candidatas a protagonizar un bonito anuncio de biquinis en las Islas Maldivas, donde la temperatura no es la de Londres y, de paso, las chicas ligaban bronceado."
1348,"('Michaela', 'preguntaba')","¿""Cómo podrán conocer nuestra personalidad y nuestra capacidad en tan poco tiempo?"", se preguntaba Michaela Salacova, 18 años y Miss República Checa."
1356,"('teme', '')","Se teme que estos hechos, ocurridos el pasado domingo, arrastren la situación a una nueva y peligrosa escalada de violencia que se inició anoche con tres explosiones en la ciudad mediterránea israelí de Netanya, causando heridas a una cuarentena de personas."
1361,"('trató', '')","Según la policía, se trató de unos 10 kilos de explosivos que también causaron daños materiales en tiendas y vehículos."
1369,"('incidente', 'produjo')","También en Tulkarem, se produjo en la madrugada de ayer un incidente armado con tropas israelís en el que murieron dos miembros de las fuerzas de seguridad palestinas en situación confusa."
1371,"('niño', 'perdió')","En Hebrón, ayer perdió la vida un niño de 10 años que el domingo había resultado gravemente herido en un intercambio de fuego en esta zona."
1372,"('clamó', '')","Asimismo, durante el sepelio multitudinario de un líder de la ultraderecha israelí, Binyamin Zeev Cahana, y de su esposa se clamó a la venganza."
1375,"('joven', 'murió')","En Jizme, al norte de Jerusalén, ayer murió un joven de 22 años abatido por los disparos de colonos judíos que penetraron en esta localidad."
1381,"('Rivaldo', 'figuran')",Entre el grupo de jugadores que deberán resolver este ingrato compromiso (los octavos de final ya se disputarán a doble partido) no figuran ni Rivaldo ni Overmars ni De la Peña.
1383,"('explicó', '')","""Les he dado descanso porque hay que dosificar a la plantilla ya que nos espera un mes de Febrero muy apretado"", explicó."
1388,"('comunicado', '')","En su afán por esconder sus planes, ni siquiera ha comunicado la decisión a los jugadores."
1390,"('dijo', '')","""Hay que tomar precauciones"", dijo."
1395,"('Conozco', '')","Conozco al entrenador, Alvaro, y le gusta el buen fútbol."
1396,"('aseguró', '')","El nivel del equipo es muy alto, juegan muy ordenados y son muy competitivos "", aseguró, advirtiendo que es un rival superior al Gandia."
1409,"('ventas', 'incrementaron')","También se incrementaron las ventas de minidisc, que superaron ampliamente al mercado de videos musicales."
1429,"('violín', 'destaca')","De la amplia gama de instrumentos que se pueden observar en la colección, destaca un violín llamado Ex Von Szerdahely VieuxTemps, de 1736."
1432,"('Yehudi', 'suspiró')","Por él suspiró Yehudi Menuhin, que elogió su sonoridad."
1437,"('Claude', 'dijo')","Los violines no se pueden copiar, son únicos "", dijo Claude Lebet, uno de los luthiers más reconocido."
1440,"('Claude', 'apuntó')","El resto de las familias optó por una vía más instintiva "", apuntó Claude Lebet."
1444,"('información', 'solicitar')","Además de la vía telefónica, también se puede solicitar la información tributaria personalizada por Internet, a través del dominio www.aeat.es, aunque en estos casos es necesario que la persona que pide sus datos disponga de un certificado de autentificación de la Fábrica Nacional de Moneda y Timbre."
1450,"('incluir', '')","En este caso, deberá incluirlas en el sobre de su declaración de la Renta para que se tengan en cuenta en el proceso de revisión."
1452,"('Llegará', '')",Llegará con Guns n'Roses al Sant Jordi el 20 de junio.
1462,"('políticos', 'intervienen')","En el programa intervienen políticos, historiadores, profesores universitarios y víctimas del terrorismo."
1467,"('canción', 'faltará')","Entre ellas, no faltará la canción Forever Love, de los X-Japan, grupo del que el ministro es fan declarado hasta el punto de que sonó con fuerza en todos sus actos de campaña electoral."
1468,"('Elvis', 'faltará')","En el compacto, que todavía no tiene fecha de salida al mercado, no faltará tampoco ni Elvis ni el italiano Arturo Paganini."
1473,"('añadió', '')",A su falta de dominio del ritmo parlamentario - - el miércoles perdió un debate cuerpo a cuerpo con Pujol simplemente porque no calculó el tiempo que tenía para intervenir - - añadió luego otra dosis de desconcierto a su estrategia de oposición al pronunciarse a favor del adelanto electoral en Catalunya.
1474,"('hizo', '')","Lo hizo a remolque del presidente de Iniciativa, Joan Saura, y después de llevar meses amagando con la presentación de una moción de censura que nunca llega."
1475,"('Da', '')",Da la sensación de que Maragall fía demasiadas cartas a su evidente brillantez.
1476,"('hace', '')","Pero lo hace desde la improvisación y sin asumir el sofisticado papel de cabeza visible de la oposición, entre cuyas obligaciones está transmitir con claridad sus ideas alternativas para derrotar a CiU cuando toquen elecciones, que de momento es en el otoño del 2003."
1477,"('vivimos', '')","Hace unos años, con la recuperación de la democracia y las libertades, vivimos con regocijo libertador el momento en que nuestras compañeras, las mujeres, se libraron de uno de los tabúes de su sexo, y empezaron a exhibir, gozosas, en playas y piscinas, sus senos secularmente escondidos."
1482,"('Será', '')",¿Será que el tabú del seno materno es demasiado fuerte para destruirlo?.
1491,"('SUPREMO', 'DICE')",LO QUE DICE EL SUPREMO.
1499,"('jugador', 'elogia')","Su labor la elogia incluso un jugador díscolo como pocos, Clarence Seedorf, que ha recobrado su mejor nivel: ""Ganemos o perdamos, ahora tenemos un equipo con espíritu, con la mentalidad justa""."
1506,"('Kallon', 'forman')","La forman Kallon, jugador de Sierra Leona, y Ventola, un delantero forjado en la cantera del Inter que ha recuperado este año del Atalanta."
1516,"('tendremos', '')","Si a eso añadimos las imágenes intercaladas de unos niños, a uno de los cuales le falta un ojo, acosando con sus perros a una vaca que está inmovilizada en la ciénaga ponzoñosa, y la contemplación que de la decadente escena del fin de fiesta junto a la piscina hacen otras niñas, hijas de los anfitriones del festejo etílico, tendremos la medida justa de lo que intenta y provoca Lucrecia Martel con su debut: crear una sensación permanente de malestar, de enfermizo y a la vez realista agobio cotidiano, a través de la cual se cuelan los retazos dramáticos de la existencia de dos familias emparentadas."
1522,"('decidieron', '')",Ayer decidieron suspender la protesta porque el ayuntamiento ha empezado a adecentar el barrio.
1525,"('Es', '')",Es como si quisiera ocultar aquello que cada noche atrae a propios y extraños como un emblema más de la urbe de las mil caras.
1526,"('era', '')","Hasta el viernes pasado, ir al Bagdad era ir a ver un espectáculo porno con el regusto de lo prohibido."
1529,"('topa', '')","Cuando el espectador desciende por las escaleras de la sala pionera del sexo en vivo (abrió en 1976), se topa con ella."
1530,"('Francisco', 'explica')","""La primera vez que bajé y vi la pared pensé que la habían hecho los dueños para que la sala pareciera una cueva de vicio y perversión"", explica Francisco S., de 30 años."
1532,"('añade', '')","""La gente que viene niega haber estado aquí, pero ahora, con la muralla, tendrán excusa para reconocerlo"", añade con mirada cómplice a David."
1534,"('descanso', 'Llega')","Llega un descanso, pero vacila antes de responder: ""Me ha extrañado mucho lo de la muralla, pero por eso he venido"" ."
1535,"('estuve', '')",""" Hacía muchos años que estuve y no lo sabía""."
1537,"('Actúan', '')","Actúan desde hace cinco años en el Bagdad y, ahora, se sienten más orgullosos de la pared que tienen delante cuando copulan en escena."
1539,"('Claudia', 'dice')","Y es que cuando toco la pared noto que tiene historia, que tiene sentimiento "", dice Claudia, segura de saber siempre lo que toca."
1541,"('Desea', '')",Desea poner una placa y ofrecer un poco de historia entre jadeo y vaivén.
1542,"('cuenta', '')","""Si nos catalogan, podremos hacer un número especial en el espectáculo"", cuenta."
1545,"('Pensaba', '')","""Pensaba que era romana, pero siempre he sabido que tenía mucha historia."
1547,"('técnico', 'añade')","Que si el número del enano, que si la que lo hace con 10 y ahora esto "", añade el técnico, un fotógrafo que lleva la mitad de su vida bañando de luz y sonido miles de espectáculos porno desde su pétreo e histórico agujero."
1548,"('arma', '')","Siempre que el Bagdad hace algo, se arma."
1551,"('preacuerdo', 'firmó')","El pasado jueves se firmó en Londres un preacuerdo privado entre los actuales dueños, el grupo japonés Sogo, y el Deutsche Bank."
1558,"('fondo', 'figuraba')","Entre los aspirantes figuraba el fondo participado por Prudential y Goldman Sachs - - Strategic Hotel Capital (SHC) - -, aliado con un consorcio español integrado por el propietario de Inditex, Amancio Ortega, la empresaria Alicia Koplowitz y el grupo inversor catalán Metrópolis (en el que participa la familia Lara, propietaria del grupo editorial Planeta)."
1559,"('Ofrecieron', '')","Ofrecieron 36.000 millones de pesetas (216,3 millones de euros)."
1569,"('ve', '')",Cuando Sam (Sean Astin) y Frodo están en el campo con el espantapájaros se ve al fondo pasar un coche de derecha a izquierda.
