num,pairs,text1575,"('estar', '')",Teniendo en cuenta su escasa estatura y el tamaño de los habitantes de la localidad debería estar por encima de su cabeza.
1578,"('dejado', '')","En la siguiente toma, cuando ya las han dejado atrás, una estatua tiene levantado el brazo izquierdo y la otra, el derecho."
1580,"('periodo', 'Existe')",Existe un periodo de coexistencia de monedas en el que las pesetas pueden cambiarse en los bancos o gastarse en las tiendas.
1581,"('pesetas', 'cambiar')","Pasado este periodo de doble circulación, que acaba el 28 de febrero, se podrán cambiar pesetas por euros en cualquier banco hasta el 30 de junio."
1591,"('esgrimió', '')","Para demostrarlo, esgrimió una papeleta recibida por un ayuntamiento socio de la entidad en la que se pide el apoyo para Porta."
1594,"('Apuntó', '')","Apuntó que asume las críticas de la oposición ""deportivamente"" y agregó: ""No sé qué gran pecado he hecho para merecer todo esto y puede ser que me decapite yo mismo; así, trabajo hecho""."
1601,"('hay', '')","Junto al elevado índice de delincuencia de los inmigrantes sumergidos en las bolsas de marginalidad, hay al menos otras dos causas que explican este dato: primero, que a muchos extranjeros (44.139 el año pasado) se les detiene sólo por estar en situación irregular; y segundo, que la fiscalía pide sistemáticamente el ingreso en prisión preventiva de los inmigrantes sin papeles."
1607,"('bailaron', '')","Y luego, claro, bailaron locos de alegría por la gesta conseguida cuando el torneo abría sus puertas."
1608,"('suena', '')",Así como suena.
1611,"('encontrado', '')","Si la FIFA, convaleciente de una cruenta batalla interna, salpicada por la plaga de la corrupción, hubiera buscado un escenario mejor no lo habría encontrado."
1614,"('pujanza', 'surgió')","Cuando todas las televisiones estaban conectadas con el inexplorado y desconocido mercado asiático, surgió la imparable pujanza de Senegal que encarna el crecimiento de África, un continente que se resiste a vivir eternamente en la pobreza."
1616,"('asoma', '')","Paso a paso, se asoma orgulloso a la élite, sin preguntar por quién tiene delante."
1617,"('Roger', 'dijo')","""Ha jugado de forma extraordinaria, sensacional. Ha sido un gran Senegal"", dijo ayer un rendido y entregado Roger Lemerre, el técnico francés."
1618,"('técnico', 'añadió')","""Claro que nos ha complicado el futuro porque era capital empezar con tres puntos"", añadió el técnico, que se mostró ""tremendamente desolado""."
1621,"('Pensó', '')","Pensó que hay vida sin Zidane, pero Senegal se encargó de demostrarle que no es así."
1622,"('alzó', '')","Además, alzó la voz en el momento justo para recordar que el fútbol también ha llegado a África."
1623,"('Tuvo', '')","Tuvo que ser, curiosamente, en Seúl, la ciudad donde en 1988 lograra este país, de apenas nueve millones de habitantes, su primera medalla olímpica."
1624,"('Tuvo', '')",Tuvo que ser en Seúl teniendo por testigos directos a 62.561 espectadores y millones y millones de personas esparcidas por el planeta.
1627,"('Tiene', '')",Tiene un inagotable talento humano y no existe mayor tesoro.
1628,"('Bruno', 'proclamó')","""Este partido lo habíamos soñado, lo habíamos pensado y lo hemos conseguido. Es un gran premio para nuestro país y para los jugadores"", proclamó un emocionado Bruno Metsu, un anónimo técnico francés que ha ganado a Francia."
1630,"('sabe', '')",Y sabe lo que quiere: jugar de forma sencilla.
1631,"('Metsu', 'añadió')","""Estamos muy contentos de haber logrado esta increíble hazaña"", añadió Metsu, sin comprender aún la dimensión de esa victoria."
1633,"('dijo', '')","""Es mentira"", dijo, en respuesta al vicepresidente Mariano Rajoy, quien sugirió que la inactividad de la organización terrorista se explica por un pacto entre la banda y los nacionalistas."
1635,"('Da', '')","Da la impresión de que desean que ETA actúe""."
1637,"('quejó', '')","""No hay derecho"", se quejó, en alusión a la ""identificación"" que hacen los populares entre el PNV y ETA."
1638,"('atacan', '')","""Nos atacan porque se lo pide el cuerpo, porque quieren ganar votos del Ebro para abajo y para tapar sus miserias""."
1641,"('líder', 'negó')","Tres veces negó el líder peneuvista que su partido se vaya a ""tirar al monte"" en septiembre, cuando concluya el ultimátum que el lehendakari, Juan José Ibarretxe, dio a José María Aznar para traspasar las competencias pendientes a Euskadi."
1642,"('echaremos', '')","""No nos echaremos al monte, pero tampoco nos vamos a quedar como lelos."
1643,"('dijo', '')","La ley da para mucho y la voluntad del pueblo también "", dijo."
1645,"('dijo', '')","""Hemos hecho un acuerdo porque creemos que es justo y es nuestro camino"", dijo."
1648,"('Arzalluz', 'dijo')","""En el PNV tenemos derecho a pensar de él lo que nos parece si realmente es un nostálgico del franquismo"", dijo Arzalluz, que también criticó al director del Euskobarómetro, Francisco Llera, que anunció su marcha de Euskadi: ""se va con el chollo que le han dado (una cátedra en Nueva York), como si se le hubiéramos echado""."
1651,"('Citó', '')",Citó un texto del presidente en el diario Nueva Rioja del 9 de marzo de 1979.
1653,"('aprueba', '')",""" El de Guernica aprueba por unanimidad retirar la medalla de la villa así como todos los honores concedidos al anterior jefe del Estado que, aunque moleste a muchos, gobernó 40 años y se llamaba Francisco Franco""."
